[
  {
    "id": "ancient_shrine",
    "emoji": "tile_altar",
    "title": "Standing Stone",
    "flavor": "A lichen-crusted dolmen hums with old power. The Sídhe do not give freely.",
    "options": [
      {
        "label": "Offer HP (20)",
        "desc": "Sacrifice 20 HP for a random boon.",
        "handler": "shrine_offer_hp",
        "params": {
          "hpCost": 20
        }
      },
      {
        "label": "Leave undisturbed",
        "desc": "Nothing happens.",
        "handler": "static_message",
        "resultMsg": "You leave the stone undisturbed."
      }
    ]
  },
  {
    "id": "healing_spring",
    "emoji": "item_droplet",
    "title": "Sacred Well",
    "flavor": "A holy well bubbles up between the stones, its waters blessed by the old gods.",
    "options": [
      {
        "label": "Drink deeply",
        "desc": "Restore to full HP.",
        "handler": "spring_full_heal"
      },
      {
        "label": "Fill your flask",
        "desc": "Heal 25 HP and gain +2% Max HP regen per tick.",
        "handler": "spring_fill_flask",
        "params": {
          "healAmount": 25,
          "regenBonus": 0.02
        }
      }
    ]
  },
  {
    "id": "fallen_champion",
    "emoji": "sprite_equip_iron_sword",
    "title": "The Fallen of Mag Tuired",
    "flavor": "A warrior of the Tuatha Dé lies here, spear still in hand, carried down into the deep long after the great battle ended.",
    "options": [
      {
        "label": "Take their boon",
        "desc": "Absorb the power of a fallen hero.",
        "handler": "champion_take_boon",
        "params": {
          "tierBreakFloor": 5
        }
      },
      {
        "label": "Take their rations",
        "desc": "Heal 35 HP.",
        "handler": "champion_rations",
        "params": {
          "healAmount": 35
        }
      }
    ]
  },
  {
    "id": "dark_bargain",
    "emoji": "fx_arcane",
    "title": "The Púca's Bargain",
    "flavor": "A shape shifts in the shadows — the Púca offers a bargain, as it always does, at a price.",
    "options": [
      {
        "label": "Accept the deal",
        "desc": "+12 ATK, −25 Max HP.",
        "handler": "bargain_accept",
        "params": {
          "atkBonus": 12,
          "hpCost": 25
        }
      },
      {
        "label": "Refuse the voice",
        "desc": "Nothing happens. Some deals aren't worth making.",
        "handler": "static_message",
        "resultMsg": "You refuse the Púca's offer. It shrieks and dissolves into mist."
      }
    ]
  },
  {
    "id": "tome_of_knowledge",
    "emoji": "item_book",
    "title": "The Ogham Stone",
    "flavor": "Ancient ogham notches catch the light, whispering half-forgotten lore.",
    "options": [
      {
        "label": "Study tactics",
        "desc": "Gain 150 XP.",
        "handler": "tome_tactics",
        "params": {
          "xpGain": 150
        }
      },
      {
        "label": "Learn from lore",
        "desc": "+2 vision radius permanently.",
        "handler": "tome_lore",
        "params": {
          "visionBonus": 2
        }
      }
    ]
  },
  {
    "id": "abandoned_cache",
    "emoji": "item_gold_pouch",
    "title": "Fomorian Plunder",
    "flavor": "A raiders' stash, abandoned in haste. The Fomorians left in a hurry.",
    "options": [
      {
        "label": "Search carefully",
        "desc": "Gain 800 gold.",
        "handler": "cache_search",
        "params": {
          "gold": 800
        }
      },
      {
        "label": "Grab quickly",
        "desc": "50/50: gain 2000 gold OR trigger a trap (−30 HP).",
        "handler": "cache_gamble",
        "params": {
          "successChance": 0.5,
          "jackpotGold": 2000,
          "trapDamage": 30
        }
      }
    ]
  },
  {
    "id": "mystic_font",
    "emoji": "special_sacred",
    "title": "Font of Danu",
    "flavor": "Runes of the Tuatha Dé Danann glow faintly, charged with Otherworld power.",
    "options": [
      {
        "label": "Purify",
        "desc": "Cure all status effects and gain poison immunity.",
        "handler": "font_purify"
      },
      {
        "label": "Empower",
        "desc": "+2 ATK permanently.",
        "handler": "font_empower",
        "params": {
          "atkBonus": 2
        }
      }
    ]
  },
  {
    "id": "cursed_armory",
    "emoji": "sprite_equip_dagger",
    "title": "Fomorian Armory",
    "flavor": "Barbed iron weapons of the sea-raiders, still stained dark.",
    "options": [
      {
        "label": "Take the cursed blade",
        "desc": "+8 ATK — but suffer 3 turns of poison.",
        "handler": "armory_cursed_blade",
        "params": {
          "atkBonus": 8,
          "poisonDuration": 3,
          "poisonPower": 4
        }
      },
      {
        "label": "Walk away",
        "desc": "Some power is not worth the price.",
        "handler": "static_message",
        "resultMsg": "You leave the Fomorian iron untouched."
      }
    ]
  },
  {
    "id": "rift_scholar",
    "emoji": "item_scroll",
    "title": "Echo of the Fili",
    "flavor": "A fractured echo of a poet-seer lingers, reciting fragments of forgotten verse.",
    "options": [
      {
        "label": "Learn combat theory",
        "desc": "+50 XP and +1 combat level.",
        "handler": "scholar_combat_theory",
        "params": {
          "xpGain": 50,
          "combatLevelBonus": 1
        }
      },
      {
        "label": "Absorb passive wisdom",
        "desc": "+3 vision, +2% Max HP regen/tick permanently.",
        "handler": "scholar_wisdom",
        "params": {
          "visionBonus": 3,
          "regenBonus": 0.02
        }
      }
    ]
  },
  {
    "id": "salmon_of_knowledge",
    "emoji": "sprite_crystal",
    "title": "The Salmon of Segais",
    "flavor": "A salmon glimmers beneath black water. Nine hazels overhang the Well of Segais and drop their nuts into it, and the salmon that eat them take up all the wisdom of the world — every drop of which runs down here eventually.",
    "options": [
      {
        "label": "Taste the salmon",
        "desc": "+3 vision, +2% Max HP regen/tick permanently.",
        "handler": "scholar_wisdom",
        "params": {
          "visionBonus": 3,
          "regenBonus": 0.02
        }
      },
      {
        "label": "Let it swim on",
        "desc": "Nothing happens.",
        "handler": "static_message",
        "resultMsg": "You let the salmon swim on, wisdom deferred to another day."
      }
    ]
  },
  {
    "id": "neit_fury",
    "emoji": "sprite_equip_war_axe",
    "title": "Neit's Fury",
    "flavor": "Old war hangs in this stone like smoke. Neit, god of battle, was grandfather to Balor and husband to Nemain, and the rage he lent the Tuatha Dé at Mag Tuired never entirely left the ground it was spent on.",
    "options": [
      {
        "label": "Take up Neit's rage",
        "desc": "+14 ATK, −20 Max HP.",
        "handler": "bargain_accept",
        "params": {
          "atkBonus": 14,
          "hpCost": 20
        }
      },
      {
        "label": "Master your fury",
        "desc": "Nothing happens.",
        "handler": "static_message",
        "resultMsg": "You steady your breath. The war-god's rage passes you by, this time."
      }
    ]
  },
  {
    "id": "banshee_keening",
    "emoji": "sprite_boss_wraith",
    "title": "The Keening",
    "flavor": "A banshee's cry rides the wind — an omen of a death not yet decided. To hear it and live is a kind of luck.",
    "options": [
      {
        "label": "Heed the warning",
        "desc": "Cure all status effects and gain poison immunity.",
        "handler": "font_purify"
      },
      {
        "label": "Laugh in its face",
        "desc": "+6 ATK — but the omen's chill lingers (3 turns poison).",
        "handler": "armory_cursed_blade",
        "params": {
          "atkBonus": 6,
          "poisonDuration": 3,
          "poisonPower": 3
        }
      }
    ]
  },
  {
    "id": "well_of_segais",
    "emoji": "sprite_mana_potion",
    "title": "The Well of Segais",
    "flavor": "Nine hazel trees ring this well, forever dropping their nuts of wisdom into the water below — the source of every river in Ériu.",
    "options": [
      {
        "label": "Drink from the well",
        "desc": "Heal 30 HP and gain +2% Max HP regen per tick.",
        "handler": "spring_fill_flask",
        "params": {
          "healAmount": 30,
          "regenBonus": 0.02
        }
      },
      {
        "label": "Stare into its depths",
        "desc": "+2 vision radius permanently.",
        "handler": "tome_lore",
        "params": {
          "visionBonus": 2
        }
      }
    ]
  },
  {
    "id": "selkie_pelt",
    "emoji": "sprite_charm",
    "title": "The Selkie's Pelt",
    "flavor": "A sealskin lies discarded on cold stone, warm as though shed only moments ago. To wear it is to become something Other.",
    "options": [
      {
        "label": "Wear the pelt",
        "desc": "Absorb the power of the Otherworld.",
        "handler": "champion_take_boon",
        "params": {
          "tierBreakFloor": 6
        }
      },
      {
        "label": "Leave it be",
        "desc": "Nothing happens.",
        "handler": "static_message",
        "resultMsg": "Some transformations aren't meant for you. You leave the pelt for its owner."
      }
    ]
  },
  {
    "id": "manannan_mist",
    "emoji": "sprite_ward",
    "title": "Manannán's Mist",
    "flavor": "A silver fog rolls in off an unseen sea — Manannán mac Lir's mist, which hides the Otherworld's roads from mortal eyes.",
    "options": [
      {
        "label": "Walk blind into the mist",
        "desc": "50/50: gain 2200 gold OR stumble into a trap (−28 HP).",
        "handler": "cache_gamble",
        "params": {
          "successChance": 0.5,
          "jackpotGold": 2200,
          "trapDamage": 28
        }
      },
      {
        "label": "Wait for it to clear",
        "desc": "Nothing happens.",